[
  {
    "contract": "ara.component-manifest",
    "version": "0.1.0",
    "componentId": "org.ara.prototype.semantic-expression",
    "release": "0.1.0",
    "family": "semantic-mathematics",
    "authority": "research-prototype",
    "schemas": {
      "representation": "semantic-mathematics.schema.json#/$defs/representation",
      "activity": "semantic-mathematics.schema.json#/$defs/activity",
      "response": "semantic-mathematics.schema.json#/$defs/response",
      "validator": "semantic-mathematics.schema.json#/$defs/validator",
      "feedback": "common.schema.json#/$defs/feedbackContract"
    },
    "capabilities": {
      "responseModes": ["semantic-expression"],
      "validatorModes": ["deterministic"],
      "determinism": "fully-deterministic",
      "rendererGeometryCanonical": false
    },
    "runtimeRequirements": {
      "kind": "deterministic-local",
      "network": "none",
      "filesystem": "none",
      "execution": "trusted-validator",
      "runtimeVersion": "prototype-cas-adapter-0.1",
      "reproducibilityDigest": "sha256:1111111111111111111111111111111111111111111111111111111111111111"
    },
    "securityBoundary": {
      "courseSuppliedCode": "forbidden",
      "trustedComponentCode": "installed-approved-adapter",
      "learnerCode": "forbidden",
      "networkPolicy": "none",
      "dataRetention": "local-persistent",
      "sensitiveData": "forbidden"
    },
    "accessibility": {
      "keyboard": "required",
      "screenReader": "required",
      "reflow": "required",
      "nonDragAlternative": "required",
      "focusOrder": "required",
      "textAlternative": "required",
      "knownLimits": []
    },
    "offlineProfile": {
      "grade": "package-required",
      "networkDuringStudy": "forbidden",
      "packageRequirements": ["semantic-math-input", "deterministic-math-validator"],
      "maximumSuggestedPackageMiB": 25
    },
    "localization": {
      "uiLocales": ["pt-BR", "pt-PT", "en"],
      "authoredContentLanguageMetadata": "required",
      "translatableInterfaceStringsSeparate": true
    },
    "provenance": {
      "authority": "project-authored",
      "createdAt": "2026-08-03T03:20:00Z",
      "sourceIds": ["SYS04", "SYS06"],
      "license": "CC-BY-4.0",
      "contentDigest": "sha256:0000000000000000000000000000000000000000000000000000000000000000"
    }
  },
  {
    "contract": "ara.component-manifest",
    "version": "0.1.0",
    "componentId": "org.ara.prototype.relational-construction",
    "release": "0.1.0",
    "family": "relational-construction",
    "authority": "research-prototype",
    "schemas": {
      "representation": "relational-construction.schema.json#/$defs/representation",
      "activity": "relational-construction.schema.json#/$defs/activity",
      "response": "relational-construction.schema.json#/$defs/response",
      "validator": "relational-construction.schema.json#/$defs/validator",
      "feedback": "common.schema.json#/$defs/feedbackContract"
    },
    "capabilities": {
      "responseModes": ["semantic-final-state", "operation-log"],
      "validatorModes": ["deterministic"],
      "determinism": "fully-deterministic",
      "rendererGeometryCanonical": false
    },
    "runtimeRequirements": {
      "kind": "deterministic-local",
      "network": "none",
      "filesystem": "none",
      "execution": "declarative",
      "runtimeVersion": "graph-predicate-adapter-0.1",
      "reproducibilityDigest": "sha256:2222222222222222222222222222222222222222222222222222222222222222"
    },
    "securityBoundary": {
      "courseSuppliedCode": "forbidden",
      "trustedComponentCode": "installed-approved-adapter",
      "learnerCode": "forbidden",
      "networkPolicy": "none",
      "dataRetention": "local-persistent",
      "sensitiveData": "forbidden"
    },
    "accessibility": {
      "keyboard": "required",
      "screenReader": "required",
      "reflow": "bidimensional-exception-with-alternative",
      "nonDragAlternative": "required",
      "focusOrder": "required",
      "textAlternative": "required",
      "knownLimits": ["Complex dense graphs require a linearized node-edge view."]
    },
    "offlineProfile": {
      "grade": "full",
      "networkDuringStudy": "forbidden",
      "packageRequirements": ["graph-model", "keyboard-construction-adapter"],
      "maximumSuggestedPackageMiB": 8
    },
    "localization": {
      "uiLocales": ["pt-BR", "pt-PT", "en"],
      "authoredContentLanguageMetadata": "required",
      "translatableInterfaceStringsSeparate": true
    },
    "provenance": {
      "authority": "project-authored",
      "createdAt": "2026-08-03T03:20:00Z",
      "sourceIds": ["SYS08", "SYS11"],
      "license": "CC-BY-4.0",
      "contentDigest": "sha256:0000000000000000000000000000000000000000000000000000000000000000"
    }
  },
  {
    "contract": "ara.component-manifest",
    "version": "0.1.0",
    "componentId": "org.ara.prototype.executable-python",
    "release": "0.1.0",
    "family": "executable-programming",
    "authority": "research-prototype",
    "schemas": {
      "representation": "executable-programming.schema.json#/$defs/representation",
      "activity": "executable-programming.schema.json#/$defs/activity",
      "response": "executable-programming.schema.json#/$defs/response",
      "validator": "executable-programming.schema.json#/$defs/validator",
      "feedback": "common.schema.json#/$defs/feedbackContract"
    },
    "capabilities": {
      "responseModes": ["code-document", "execution-request"],
      "validatorModes": ["deterministic"],
      "determinism": "fully-deterministic",
      "rendererGeometryCanonical": false
    },
    "runtimeRequirements": {
      "kind": "sandboxed-worker",
      "network": "none",
      "filesystem": "ephemeral-readwrite",
      "execution": "sandboxed-code",
      "timeLimitMs": 2500,
      "memoryLimitMiB": 128,
      "runtimeVersion": "python-wasm-prototype-0.1",
      "reproducibilityDigest": "sha256:3333333333333333333333333333333333333333333333333333333333333333"
    },
    "securityBoundary": {
      "courseSuppliedCode": "forbidden",
      "trustedComponentCode": "installed-approved-adapter",
      "learnerCode": "sandboxed",
      "networkPolicy": "runtime-specific",
      "dataRetention": "local-session",
      "sensitiveData": "forbidden"
    },
    "accessibility": {
      "keyboard": "required",
      "screenReader": "required",
      "reflow": "required",
      "nonDragAlternative": "required",
      "focusOrder": "required",
      "textAlternative": "required",
      "knownLimits": []
    },
    "offlineProfile": {
      "grade": "package-required",
      "networkDuringStudy": "forbidden",
      "packageRequirements": ["code-editor", "python-wasm-runtime", "test-runner"],
      "maximumSuggestedPackageMiB": 80
    },
    "localization": {
      "uiLocales": ["pt-BR", "pt-PT", "en"],
      "authoredContentLanguageMetadata": "required",
      "translatableInterfaceStringsSeparate": true
    },
    "provenance": {
      "authority": "project-authored",
      "createdAt": "2026-08-03T03:20:00Z",
      "sourceIds": ["SYS09", "SYS10"],
      "license": "CC-BY-4.0",
      "contentDigest": "sha256:0000000000000000000000000000000000000000000000000000000000000000"
    }
  },
  {
    "contract": "ara.component-manifest",
    "version": "0.1.0",
    "componentId": "org.ara.prototype.source-argument",
    "release": "0.1.0",
    "family": "source-argument",
    "authority": "research-prototype",
    "schemas": {
      "representation": "source-argument.schema.json#/$defs/representation",
      "activity": "source-argument.schema.json#/$defs/activity",
      "response": "source-argument.schema.json#/$defs/response",
      "validator": "source-argument.schema.json#/$defs/validator",
      "feedback": "common.schema.json#/$defs/feedbackContract"
    },
    "capabilities": {
      "responseModes": ["annotation-set", "argument-graph"],
      "validatorModes": ["deterministic", "human-review", "probabilistic-assistance"],
      "determinism": "mixed-authority",
      "rendererGeometryCanonical": false
    },
    "runtimeRequirements": {
      "kind": "human-review",
      "network": "none",
      "filesystem": "none",
      "execution": "none"
    },
    "securityBoundary": {
      "courseSuppliedCode": "forbidden",
      "trustedComponentCode": "installed-approved-adapter",
      "learnerCode": "forbidden",
      "networkPolicy": "none",
      "dataRetention": "local-persistent",
      "sensitiveData": "forbidden"
    },
    "accessibility": {
      "keyboard": "required",
      "screenReader": "required",
      "reflow": "required",
      "nonDragAlternative": "required",
      "focusOrder": "required",
      "textAlternative": "required",
      "knownLimits": []
    },
    "offlineProfile": {
      "grade": "full",
      "networkDuringStudy": "forbidden",
      "packageRequirements": ["text-annotation-adapter", "argument-editor"],
      "maximumSuggestedPackageMiB": 6
    },
    "localization": {
      "uiLocales": ["pt-BR", "pt-PT", "en"],
      "authoredContentLanguageMetadata": "required",
      "translatableInterfaceStringsSeparate": true
    },
    "provenance": {
      "authority": "project-authored",
      "createdAt": "2026-08-03T03:20:00Z",
      "sourceIds": ["SYS20"],
      "license": "CC-BY-4.0",
      "contentDigest": "sha256:0000000000000000000000000000000000000000000000000000000000000000"
    }
  }
]
